[
  {
    "id": "alps",
    "name": "Alps",
    "free": true,
    "tagline": "Cold air, pine shade and granite.",
    "ambient": "#a4b8d0",
    "ambientIntensity": 0.5,
    "sky": {
      "top": "#2b4b78",
      "mid": "#8fb0d2",
      "bot": "#dbe6ee",
      "sunGlow": "#fff2d6",
      "stars": 0,
      "clouds": "#ffffff"
    },
    "sun": {
      "color": "#fff3dc",
      "intensity": 2.6,
      "pos": [
        26,
        36,
        -30
      ]
    },
    "hemi": {
      "sky": "#a9c4dd",
      "ground": "#4f5a47",
      "intensity": 0.8
    },
    "fog": {
      "color": "#bccbd8",
      "density": 0.013
    },
    "ground": "#5f6e4f",
    "groundNoise": "#4d5b40",
    "road": {
      "base": "#3b3c40",
      "edge": "#d9d3bf",
      "line": "#efe7c9",
      "center": "#e8c55a"
    },
    "horizon": {
      "kind": "mountains",
      "colorFar": "#6f88a8",
      "colorNear": "#4a607e",
      "snow": true
    },
    "props": [
      {
        "kind": "pine",
        "every": 7,
        "side": [
          3.5,
          11
        ],
        "scale": [
          0.9,
          1.5
        ]
      },
      {
        "kind": "rock",
        "every": 11,
        "side": [
          3.2,
          10
        ],
        "scale": [
          0.5,
          1.15
        ]
      },
      {
        "kind": "tuft",
        "every": 1.6,
        "side": [
          2.9,
          16
        ],
        "scale": [
          0.8,
          1.6
        ],
        "tint": "#728f4a"
      }
    ],
    "accent": "#ffc93c",
    "coin": "#ffd166"
  },
  {
    "id": "desert",
    "name": "Desert",
    "free": true,
    "tagline": "Heat haze, dunes and tall saguaros.",
    "ambient": "#e8c9a0",
    "ambientIntensity": 0.55,
    "sky": {
      "top": "#2f6fb5",
      "mid": "#8fbbe0",
      "bot": "#f3dcb0",
      "sunGlow": "#fff4d0",
      "stars": 0,
      "clouds": "#ffffff"
    },
    "sun": {
      "color": "#fff0cc",
      "intensity": 3,
      "pos": [
        -30,
        28,
        -26
      ]
    },
    "hemi": {
      "sky": "#f3c88a",
      "ground": "#a66a36",
      "intensity": 0.75
    },
    "fog": {
      "color": "#e9cfa6",
      "density": 0.011
    },
    "ground": "#c89150",
    "groundNoise": "#b07c40",
    "road": {
      "base": "#55473a",
      "edge": "#e8d9b4",
      "line": "#f3e6c0",
      "center": "#e9c35e"
    },
    "horizon": {
      "kind": "dunes",
      "colorFar": "#d59a5a",
      "colorNear": "#b97b3f"
    },
    "props": [
      {
        "kind": "cactus",
        "every": 9,
        "side": [
          3,
          10
        ],
        "scale": [
          0.8,
          1.6
        ]
      },
      {
        "kind": "dune",
        "every": 14,
        "side": [
          10,
          26
        ],
        "scale": [
          0.6,
          1.4
        ]
      },
      {
        "kind": "rock",
        "every": 17,
        "side": [
          3,
          8
        ],
        "scale": [
          0.4,
          0.9
        ]
      }
    ],
    "weather": {
      "kind": "dust",
      "count": 220,
      "color": "#f1d2a0",
      "size": 0.18,
      "opacity": 0.35,
      "fall": 0.4,
      "drift": 1.5
    },
    "accent": "#ff4f24",
    "coin": "#ffd166"
  },
  {
    "id": "forest",
    "name": "Forest",
    "free": true,
    "tagline": "Deep green, tall trunks, soft light.",
    "ambient": "#9bb58a",
    "ambientIntensity": 0.5,
    "sky": {
      "top": "#3f6a4f",
      "mid": "#8fb57f",
      "bot": "#d4e3b0",
      "sunGlow": "#f7f3cc",
      "stars": 0,
      "clouds": "#f4f7ea"
    },
    "sun": {
      "color": "#f3f0d0",
      "intensity": 2,
      "pos": [
        18,
        30,
        -20
      ]
    },
    "hemi": {
      "sky": "#a8c28e",
      "ground": "#2f3d24",
      "intensity": 0.9
    },
    "fog": {
      "color": "#a8c29a",
      "density": 0.019
    },
    "ground": "#3f5a2e",
    "groundNoise": "#33491f",
    "road": {
      "base": "#4a4238",
      "edge": "#b9ae8e",
      "line": "#d8cfa8",
      "center": "#cfb35a"
    },
    "horizon": {
      "kind": "forest",
      "colorFar": "#587a55",
      "colorNear": "#3d5b3c"
    },
    "props": [
      {
        "kind": "tree",
        "every": 5,
        "side": [
          3.4,
          12
        ],
        "scale": [
          1,
          1.8
        ]
      },
      {
        "kind": "bush",
        "every": 6,
        "side": [
          3,
          7
        ],
        "scale": [
          0.6,
          1.3
        ]
      },
      {
        "kind": "tuft",
        "every": 1.4,
        "side": [
          2.9,
          14
        ],
        "scale": [
          0.8,
          1.7
        ],
        "tint": "#5f8a3a"
      }
    ],
    "weather": {
      "kind": "leaves",
      "count": 140,
      "color": "#c7d98a",
      "size": 0.14,
      "opacity": 0.8,
      "fall": 0.8,
      "drift": 0.9
    },
    "accent": "#ffc93c",
    "coin": "#ffe08a"
  },
  {
    "id": "storm",
    "name": "Storm",
    "free": false,
    "tagline": "Rain on the asphalt and lightning on the ridge.",
    "ambient": "#5a6a80",
    "ambientIntensity": 0.6,
    "sky": {
      "top": "#141a26",
      "mid": "#2e3a4c",
      "bot": "#5a6878",
      "sunGlow": "#6c7a90",
      "stars": 0,
      "clouds": "#55606c"
    },
    "sun": {
      "color": "#c3d0e0",
      "intensity": 2,
      "pos": [
        -20,
        30,
        -30
      ]
    },
    "hemi": {
      "sky": "#7a8aa0",
      "ground": "#2c323a",
      "intensity": 1.6
    },
    "fog": {
      "color": "#4c5865",
      "density": 0.021
    },
    "exposure": 1.3,
    "ground": "#24292f",
    "groundNoise": "#1c2026",
    "road": {
      "base": "#1f2227",
      "edge": "#8e949c",
      "line": "#b9bec4",
      "center": "#c9b05c",
      "wet": true
    },
    "horizon": {
      "kind": "mountains",
      "colorFar": "#2a3340",
      "colorNear": "#1d2531"
    },
    "props": [
      {
        "kind": "pine",
        "every": 8,
        "side": [
          3.5,
          12
        ],
        "scale": [
          0.8,
          1.4
        ],
        "tint": "#26322a"
      },
      {
        "kind": "lamp",
        "every": 14,
        "side": [
          3.2,
          3.2
        ],
        "scale": [
          1,
          1
        ]
      },
      {
        "kind": "tuft",
        "every": 2.4,
        "side": [
          2.9,
          12
        ],
        "scale": [
          0.7,
          1.3
        ],
        "tint": "#2f3a30"
      }
    ],
    "weather": {
      "kind": "rain",
      "count": 900,
      "color": "#b8cde0",
      "size": 0.09,
      "opacity": 0.55,
      "fall": 22,
      "drift": 1.2
    },
    "lightning": true,
    "accent": "#5cdfff",
    "coin": "#ffd166"
  },
  {
    "id": "sunset",
    "name": "Sunset",
    "free": false,
    "tagline": "Palms against a pink and gold sky.",
    "ambient": "#c98a8a",
    "ambientIntensity": 0.5,
    "sky": {
      "top": "#3a2554",
      "mid": "#c25a5a",
      "bot": "#ffc27a",
      "sunGlow": "#ffd9a0",
      "stars": 0.3,
      "clouds": "#ffb089"
    },
    "sun": {
      "color": "#ffd2a0",
      "intensity": 2.3,
      "pos": [
        0,
        10,
        -60
      ]
    },
    "hemi": {
      "sky": "#e39a7c",
      "ground": "#3a2a30",
      "intensity": 0.7
    },
    "fog": {
      "color": "#d99c86",
      "density": 0.012
    },
    "ground": "#5a4046",
    "groundNoise": "#4a3238",
    "road": {
      "base": "#3d3238",
      "edge": "#d8c2a8",
      "line": "#f0d9b8",
      "center": "#ffcf6b"
    },
    "horizon": {
      "kind": "hills",
      "colorFar": "#8c4f69",
      "colorNear": "#5a3650"
    },
    "props": [
      {
        "kind": "palm",
        "every": 7,
        "side": [
          3.4,
          10
        ],
        "scale": [
          0.9,
          1.5
        ]
      },
      {
        "kind": "lamp",
        "every": 16,
        "side": [
          3.2,
          3.2
        ],
        "scale": [
          1,
          1
        ]
      },
      {
        "kind": "tuft",
        "every": 2.2,
        "side": [
          2.9,
          12
        ],
        "scale": [
          0.7,
          1.3
        ],
        "tint": "#6a5a4a"
      }
    ],
    "accent": "#ff4f24",
    "coin": "#ffe08a"
  },
  {
    "id": "arctic",
    "name": "Arctic",
    "free": false,
    "tagline": "Blue ice, drifting snow and an aurora.",
    "ambient": "#9fb8d4",
    "ambientIntensity": 0.55,
    "sky": {
      "top": "#0b1a33",
      "mid": "#2e5a86",
      "bot": "#a9cbe0",
      "sunGlow": "#dff3ff",
      "stars": 0.6,
      "clouds": "#dfeaf3",
      "aurora": true
    },
    "sun": {
      "color": "#e4f2ff",
      "intensity": 1.6,
      "pos": [
        30,
        18,
        -40
      ]
    },
    "hemi": {
      "sky": "#8fb6d6",
      "ground": "#9db0c0",
      "intensity": 0.9
    },
    "fog": {
      "color": "#aac4d8",
      "density": 0.02
    },
    "ground": "#dfe9f1",
    "groundNoise": "#c9d8e4",
    "road": {
      "base": "#3d4650",
      "edge": "#e8f0f6",
      "line": "#f3f8fb",
      "center": "#9fd4f5"
    },
    "horizon": {
      "kind": "mountains",
      "colorFar": "#7f9fbe",
      "colorNear": "#5d7d9c",
      "snow": true
    },
    "props": [
      {
        "kind": "ice",
        "every": 8,
        "side": [
          3.4,
          11
        ],
        "scale": [
          0.5,
          1.4
        ]
      },
      {
        "kind": "pine",
        "every": 15,
        "side": [
          5,
          12
        ],
        "scale": [
          0.7,
          1.1
        ],
        "tint": "#3c5a56",
        "snow": true
      }
    ],
    "weather": {
      "kind": "snow",
      "count": 500,
      "color": "#ffffff",
      "size": 0.2,
      "opacity": 0.9,
      "fall": 2.2,
      "drift": 1.4
    },
    "accent": "#5cdfff",
    "coin": "#bfe9ff"
  },
  {
    "id": "jungle",
    "name": "Jungle",
    "free": false,